{
  "id": "coasters-and-loyalty-cards",
  "slug": "coasters-and-loyalty-cards",
  "title": "Custom printed coasters and loyalty cards",
  "category": "catering-supplies",
  "status": "published",
  "short_description": "Small printed pieces that keep your brand on the table and in the wallet: pulpboard coasters and loyalty cards, gloss or matte.",
  "description": "Two pieces of marketing print that sit alongside your packaging: absorbent pulpboard coasters for the table, and credit-card size loyalty cards for the counter. Choose the product and the finish, then send us your artwork.\n\nPut the same artwork on your [printed napkins](/catering-supplies/branded-napkins/) and [custom printed coffee cups](/coffee-cups/double-wall-cups/).\n\nYour digital proof and print plates are included in the price. Final specifications are confirmed with your written quote.",
  "benefits": [
    "Full-colour print",
    "Gloss or matte",
    "Two products"
  ],
  "faqs": [
    {
      "q": "Can I use my own design?",
      "a": "Yes. Share your logo or print-ready artwork when requesting a quote. We will confirm the artwork requirements for your chosen item, and you approve a digital proof before anything is printed."
    },
    {
      "q": "What if my artwork is not ready?",
      "a": "You can request a quote first and share your artwork later. Tell us what you have in mind and we can discuss the next steps."
    },
    {
      "q": "Are the prices shown final?",
      "a": "The prices on this page are indicative and exclude VAT, which is added at 20%. Your digital proof and print plates are included, and delivery is free to a single UK mainland address. We confirm everything in a written quote before you commit."
    },
    {
      "q": "Why do coasters come in larger quantities than loyalty cards?",
      "a": "Coasters are die-cut from pulpboard in longer runs, so their first price break is higher than for loyalty cards — the quantity options on this page show each one. If you need fewer, use “Request a custom quantity” and we will advise."
    },
    {
      "q": "When will my items arrive?",
      "a": "As a general guide, allow several weeks from artwork approval to delivery. We will confirm current timing with your quote."
    }
  ],
  "copy": {
    "eyebrow": "Custom printed / Marketing print",
    "unit": {
      "one": "item",
      "many": "items"
    },
    "image_label": "Made for your brand",
    "gallery_caption": "Illustrative design concepts. Artwork, colours and construction are confirmed with your quote.",
    "details": {
      "eyebrow": "The details",
      "heading": "Printed coasters\nand loyalty cards."
    },
    "process": {
      "eyebrow": "From idea to first order",
      "heading": "Your next regular looks good.",
      "steps": [
        {
          "eyebrow": "01 / Make it yours",
          "title": "Choose your item.",
          "text": "Select your product, finish and quantity. We’ll confirm the details and your trade quote."
        },
        {
          "eyebrow": "02 / Add your character",
          "title": "Share your artwork.",
          "text": "Send us your logo or design. We’ll agree the print requirements and send a digital proof before production."
        },
        {
          "eyebrow": "03 / Ready to serve",
          "title": "Approve, print, hand out.",
          "text": "Once the artwork is approved, we’ll confirm the production and delivery schedule."
        }
      ]
    },
    "faq": {
      "eyebrow": "Good questions",
      "heading": "Coaster and loyalty card questions,\nanswered."
    }
  },
  "specs": [
    {
      "label": "Products",
      "value": "Coasters and loyalty cards"
    },
    {
      "label": "Format",
      "value": "Round or square pulpboard coaster",
      "applies_to": {
        "product": "coasters"
      }
    },
    {
      "label": "Format",
      "value": "85 × 55 mm card",
      "applies_to": {
        "product": "loyalty-cards"
      }
    },
    {
      "label": "Printing",
      "value": "Full colour"
    },
    {
      "label": "Finish",
      "value": "Gloss",
      "applies_to": {
        "finish": "gloss"
      }
    },
    {
      "label": "Finish",
      "value": "Matte, same price",
      "applies_to": {
        "finish": "matte"
      }
    },
    {
      "label": "Proof and print plates",
      "value": "Included"
    }
  ],
  "options": [
    {
      "key": "product",
      "label": "Product",
      "values": [
        {
          "value": "coasters",
          "label": "Coasters",
          "default": true
        },
        {
          "value": "loyalty-cards",
          "label": "Loyalty cards"
        }
      ]
    },
    {
      "key": "finish",
      "label": "Finish",
      "values": [
        {
          "value": "gloss",
          "label": "Gloss",
          "default": true
        },
        {
          "value": "matte",
          "label": "Matte"
        }
      ]
    }
  ],
  "variants": [
    {
      "sku": "PRF-CST-GLS",
      "selection": {
        "product": "coasters",
        "finish": "gloss"
      },
      "available": true,
      "pricing_ref": "coasters-and-loyalty-cards-coasters"
    },
    {
      "sku": "PRF-CST-MAT",
      "selection": {
        "product": "coasters",
        "finish": "matte"
      },
      "available": true,
      "pricing_ref": "coasters-and-loyalty-cards-coasters"
    },
    {
      "sku": "PRF-LOY-GLS",
      "selection": {
        "product": "loyalty-cards",
        "finish": "gloss"
      },
      "available": true,
      "pricing_ref": "coasters-and-loyalty-cards-loyalty-cards"
    },
    {
      "sku": "PRF-LOY-MAT",
      "selection": {
        "product": "loyalty-cards",
        "finish": "matte"
      },
      "available": true,
      "pricing_ref": "coasters-and-loyalty-cards-loyalty-cards"
    }
  ],
  "pricing": [
    {
      "ref": "coasters-and-loyalty-cards-coasters",
      "currency": "GBP",
      "vat": "ex",
      "tiers": [
        {
          "qty": 5000,
          "unit": "0.114"
        },
        {
          "qty": 10000,
          "unit": "0.076"
        },
        {
          "qty": 20000,
          "unit": "0.051"
        },
        {
          "qty": 50000,
          "unit": "0.036"
        }
      ]
    },
    {
      "ref": "coasters-and-loyalty-cards-loyalty-cards",
      "currency": "GBP",
      "vat": "ex",
      "tiers": [
        {
          "qty": 1000,
          "unit": "0.051"
        },
        {
          "qty": 2500,
          "unit": "0.037"
        },
        {
          "qty": 5000,
          "unit": "0.031"
        },
        {
          "qty": 10000,
          "unit": "0.029"
        }
      ]
    }
  ],
  "charges": [],
  "lead_time": {
    "text": "Allow several weeks from artwork approval",
    "starts": "artwork approval"
  },
  "images": [
    {
      "file": "02-branded/07-marketing-print/rosa__coaster-round.png",
      "alt": "Stack of round pulpboard coasters printed with the terracotta “ROSA” coffee design",
      "order": 1,
      "role": "hero",
      "match": {
        "product": "coasters"
      }
    },
    {
      "file": "02-branded/07-marketing-print/rosa__loyalty-card.png",
      "alt": "Fanned stack of loyalty cards printed with the terracotta “ROSA” roundel and stamp circles",
      "order": 1,
      "role": "hero",
      "match": {
        "product": "loyalty-cards"
      }
    }
  ],
  "enquiry": {
    "mode": "priced"
  },
  "seo": {
    "title": "Custom Printed Coasters & Loyalty Cards | Packaged Proper",
    "description": "Price up custom printed pulpboard coasters and loyalty cards online: full colour, gloss or matte. Indicative trade prices — request a quote.",
    "canonical": "/catering-supplies/coasters-and-loyalty-cards/"
  }
}
