{
  "id": "cup-sleeves",
  "slug": "cup-sleeves",
  "title": "Custom printed cup sleeves",
  "category": "coffee-cups",
  "status": "published",
  "short_description": "Brand the cup you already use. Corrugated kraft cup sleeves printed with your logo — the lowest-cost way to put your name in every hand.",
  "description": "A corrugated kraft sleeve that fits standard 8–16 oz hot cups. One-colour print on kraft keeps the cost down; two-colour and full-colour are quoted on request. If you want to keep your current cups, a printed sleeve is the quickest route to branded drinks. Want the cup itself printed? See our [custom printed double wall coffee cups](/coffee-cups/double-wall-cups/).\n\nYour digital proof and print plates are included in the price. Final specifications are confirmed with your written quote.",
  "benefits": [
    "Fits 8–16 oz cups",
    "One-colour print",
    "Low cost per drink"
  ],
  "faqs": [
    {
      "q": "Can I use my own design?",
      "a": "Yes. Share your logo or print-ready artwork when requesting a quote. We will confirm the artwork requirements for your chosen item, and you approve a digital proof before anything is printed."
    },
    {
      "q": "What if my artwork is not ready?",
      "a": "You can request a quote first and share your artwork later. Tell us what you have in mind and we can discuss the next steps."
    },
    {
      "q": "Are the prices shown final?",
      "a": "The prices on this page are indicative and exclude VAT, which is added at 20%. Your digital proof and print plates are included, and delivery is free to a single UK mainland address. We confirm everything in a written quote before you commit."
    },
    {
      "q": "Do you supply the cups too?",
      "a": "Yes — we print double wall cups with a full-colour wrap, priced online on our double wall cups page. Sleeves suit businesses that want a printed touchpoint without switching cup supplier."
    },
    {
      "q": "When will my sleeves arrive?",
      "a": "Standard sleeves are delivered 8–9 weeks from artwork approval. Express is 4 weeks from artwork approval for 1,000 or 2,500 sleeves. We confirm timing with your written quote."
    }
  ],
  "copy": {
    "eyebrow": "Custom printed / Hot drinks",
    "unit": {
      "one": "sleeve",
      "many": "sleeves"
    },
    "image_label": "Made for your brand",
    "gallery_caption": "Illustrative design concepts. Artwork, colours and construction are confirmed with your quote.",
    "details": {
      "eyebrow": "The details",
      "heading": "Printed cup sleeves\nfor 8–16 oz cups."
    },
    "process": {
      "eyebrow": "From idea to first order",
      "heading": "Your next coffee looks good.",
      "steps": [
        {
          "eyebrow": "01 / Make it yours",
          "title": "Choose your sleeve.",
          "text": "Select your print colours and quantity. We’ll confirm the details and your trade quote."
        },
        {
          "eyebrow": "02 / Add your character",
          "title": "Share your artwork.",
          "text": "Send us your logo or design. We’ll agree the print requirements and send a digital proof before production."
        },
        {
          "eyebrow": "03 / Ready to serve",
          "title": "Approve, print, pour.",
          "text": "Once the artwork is approved, we’ll confirm the production and delivery schedule."
        }
      ]
    },
    "faq": {
      "eyebrow": "Good questions",
      "heading": "Cup sleeve questions,\nanswered."
    }
  },
  "specs": [
    {
      "label": "Fits",
      "value": "Standard 8, 12 and 16 oz hot cups"
    },
    {
      "label": "Material",
      "value": "Corrugated kraft board"
    },
    {
      "label": "Printing",
      "value": "1 colour",
      "applies_to": {
        "colours": "1"
      }
    },
    {
      "label": "Printing",
      "value": "2 colours — quoted on request",
      "applies_to": {
        "colours": "2",
        "service": "standard"
      }
    },
    {
      "label": "Printing",
      "value": "2 colours",
      "applies_to": {
        "colours": "2",
        "service": "express"
      }
    },
    {
      "label": "Printing",
      "value": "Full colour — quoted on request",
      "applies_to": {
        "colours": "full"
      }
    },
    {
      "label": "Proof and print plates",
      "value": "Included"
    },
    {
      "label": "Lead time",
      "value": "8–9 weeks from artwork approval",
      "applies_to": {
        "service": "standard"
      }
    },
    {
      "label": "Lead time",
      "value": "4 weeks from artwork approval",
      "applies_to": {
        "service": "express"
      }
    }
  ],
  "options": [
    {
      "key": "colours",
      "label": "Print colours",
      "values": [
        {
          "value": "1",
          "label": "1 colour",
          "default": true
        },
        {
          "value": "2",
          "label": "2 colours",
          "note": "Two-colour print is priced on Express; on Standard it is quoted on request."
        },
        {
          "value": "full",
          "label": "Full colour",
          "note": "Full-colour print is quoted on request."
        }
      ]
    },
    {
      "key": "service",
      "label": "Lead time",
      "values": [
        {
          "value": "standard",
          "label": "Standard · 8–9 weeks",
          "default": true
        },
        {
          "value": "express",
          "label": "Express · 4 weeks",
          "note": "Express covers 1,000 and 2,500 sleeves in 1 or 2 colours."
        }
      ]
    }
  ],
  "variants": [
    {
      "sku": "SLV-1C",
      "selection": {
        "colours": "1",
        "service": "standard"
      },
      "available": true,
      "pricing_ref": "cup-sleeves-1"
    },
    {
      "sku": "SLV-2C",
      "selection": {
        "colours": "2",
        "service": "standard"
      },
      "available": false,
      "enquiry": {
        "mode": "quote_only"
      }
    },
    {
      "sku": "SLV-FC",
      "selection": {
        "colours": "full",
        "service": "standard"
      },
      "available": false,
      "enquiry": {
        "mode": "quote_only"
      }
    },
    {
      "sku": "SLV-1C-EXP",
      "selection": {
        "colours": "1",
        "service": "express"
      },
      "available": true,
      "lead_time": {
        "text": "Express: 4 weeks from artwork approval",
        "starts": "artwork approval"
      },
      "pricing_ref": "cup-sleeves-express"
    },
    {
      "sku": "SLV-2C-EXP",
      "selection": {
        "colours": "2",
        "service": "express"
      },
      "available": true,
      "lead_time": {
        "text": "Express: 4 weeks from artwork approval",
        "starts": "artwork approval"
      },
      "pricing_ref": "cup-sleeves-express"
    }
  ],
  "pricing": [
    {
      "ref": "cup-sleeves-1",
      "currency": "GBP",
      "vat": "ex",
      "tiers": [
        {
          "qty": 5000,
          "unit": "0.123"
        },
        {
          "qty": 10000,
          "unit": "0.104"
        }
      ]
    },
    {
      "ref": "cup-sleeves-express",
      "currency": "GBP",
      "vat": "ex",
      "tiers": [
        {
          "qty": 1000,
          "unit": "0.209"
        },
        {
          "qty": 2500,
          "unit": "0.161"
        }
      ]
    }
  ],
  "charges": [],
  "lead_time": {
    "text": "Standard: 8–9 weeks from artwork approval",
    "starts": "artwork approval"
  },
  "images": [
    {
      "file": "02-branded/01-hot-cups/fern__cup-sleeve.png",
      "alt": "Corrugated kraft cup sleeve printed with the “FERN” botanical design, fitted on a plain white cup",
      "order": 1,
      "role": "hero",
      "match": {}
    }
  ],
  "enquiry": {
    "mode": "priced"
  },
  "seo": {
    "title": "Custom Printed Coffee Cup Sleeves | Packaged Proper",
    "description": "Price up custom printed corrugated kraft cup sleeves online: one-colour print, fits 8–16 oz hot cups. Indicative trade prices — request a quote.",
    "canonical": "/coffee-cups/cup-sleeves/"
  }
}
